{
  "directed": false,
  "multigraph": false,
  "graph": {},
  "nodes": [
    {
      "label": "__init__.py",
      "file_type": "code",
      "source_file": "/home/safi/graph3d-benchmark/repos/minGPT/mingpt/__init__.py",
      "source_location": "L1",
      "community": 10,
      "id": "init"
    },
    {
      "label": "engine.py",
      "file_type": "code",
      "source_file": "/home/safi/graph3d-benchmark/repos/micrograd/micrograd/engine.py",
      "source_location": "L1",
      "community": 5,
      "id": "engine"
    },
    {
      "label": "Value",
      "file_type": "code",
      "source_file": "/home/safi/graph3d-benchmark/repos/micrograd/micrograd/engine.py",
      "source_location": "L2",
      "community": 5,
      "id": "engine_value"
    },
    {
      "label": ".__init__()",
      "file_type": "code",
      "source_file": "/home/safi/graph3d-benchmark/repos/micrograd/micrograd/engine.py",
      "source_location": "L5",
      "community": 5,
      "id": "engine_value_init"
    },
    {
      "label": ".__add__()",
      "file_type": "code",
      "source_file": "/home/safi/graph3d-benchmark/repos/micrograd/micrograd/engine.py",
      "source_location": "L13",
      "community": 5,
      "id": "engine_value_add"
    },
    {
      "label": ".__mul__()",
      "file_type": "code",
      "source_file": "/home/safi/graph3d-benchmark/repos/micrograd/micrograd/engine.py",
      "source_location": "L24",
      "community": 5,
      "id": "engine_value_mul"
    },
    {
      "label": ".__pow__()",
      "file_type": "code",
      "source_file": "/home/safi/graph3d-benchmark/repos/micrograd/micrograd/engine.py",
      "source_location": "L35",
      "community": 5,
      "id": "engine_value_pow"
    },
    {
      "label": ".relu()",
      "file_type": "code",
      "source_file": "/home/safi/graph3d-benchmark/repos/micrograd/micrograd/engine.py",
      "source_location": "L45",
      "community": 5,
      "id": "engine_value_relu"
    },
    {
      "label": ".backward()",
      "file_type": "code",
      "source_file": "/home/safi/graph3d-benchmark/repos/micrograd/micrograd/engine.py",
      "source_location": "L54",
      "community": 5,
      "id": "engine_value_backward"
    },
    {
      "label": ".__neg__()",
      "file_type": "code",
      "source_file": "/home/safi/graph3d-benchmark/repos/micrograd/micrograd/engine.py",
      "source_location": "L72",
      "community": 5,
      "id": "engine_value_neg"
    },
    {
      "label": ".__radd__()",
      "file_type": "code",
      "source_file": "/home/safi/graph3d-benchmark/repos/micrograd/micrograd/engine.py",
      "source_location": "L75",
      "community": 5,
      "id": "engine_value_radd"
    },
    {
      "label": ".__sub__()",
      "file_type": "code",
      "source_file": "/home/safi/graph3d-benchmark/repos/micrograd/micrograd/engine.py",
      "source_location": "L78",
      "community": 5,
      "id": "engine_value_sub"
    },
    {
      "label": ".__rsub__()",
      "file_type": "code",
      "source_file": "/home/safi/graph3d-benchmark/repos/micrograd/micrograd/engine.py",
      "source_location": "L81",
      "community": 5,
      "id": "engine_value_rsub"
    },
    {
      "label": ".__rmul__()",
      "file_type": "code",
      "source_file": "/home/safi/graph3d-benchmark/repos/micrograd/micrograd/engine.py",
      "source_location": "L84",
      "community": 5,
      "id": "engine_value_rmul"
    },
    {
      "label": ".__truediv__()",
      "file_type": "code",
      "source_file": "/home/safi/graph3d-benchmark/repos/micrograd/micrograd/engine.py",
      "source_location": "L87",
      "community": 5,
      "id": "engine_value_truediv"
    },
    {
      "label": ".__rtruediv__()",
      "file_type": "code",
      "source_file": "/home/safi/graph3d-benchmark/repos/micrograd/micrograd/engine.py",
      "source_location": "L90",
      "community": 5,
      "id": "engine_value_rtruediv"
    },
    {
      "label": ".__repr__()",
      "file_type": "code",
      "source_file": "/home/safi/graph3d-benchmark/repos/micrograd/micrograd/engine.py",
      "source_location": "L93",
      "community": 5,
      "id": "engine_value_repr"
    },
    {
      "label": "nn.py",
      "file_type": "code",
      "source_file": "/home/safi/graph3d-benchmark/repos/micrograd/micrograd/nn.py",
      "source_location": "L1",
      "community": 3,
      "id": "nn"
    },
    {
      "label": "Module",
      "file_type": "code",
      "source_file": "/home/safi/graph3d-benchmark/repos/micrograd/micrograd/nn.py",
      "source_location": "L4",
      "community": 3,
      "id": "nn_module"
    },
    {
      "label": ".zero_grad()",
      "file_type": "code",
      "source_file": "/home/safi/graph3d-benchmark/repos/micrograd/micrograd/nn.py",
      "source_location": "L6",
      "community": 3,
      "id": "nn_module_zero_grad"
    },
    {
      "label": ".parameters()",
      "file_type": "code",
      "source_file": "/home/safi/graph3d-benchmark/repos/micrograd/micrograd/nn.py",
      "source_location": "L10",
      "community": 3,
      "id": "nn_module_parameters"
    },
    {
      "label": "Neuron",
      "file_type": "code",
      "source_file": "/home/safi/graph3d-benchmark/repos/micrograd/micrograd/nn.py",
      "source_location": "L13",
      "community": 3,
      "id": "nn_neuron"
    },
    {
      "label": ".__init__()",
      "file_type": "code",
      "source_file": "/home/safi/graph3d-benchmark/repos/micrograd/micrograd/nn.py",
      "source_location": "L15",
      "community": 3,
      "id": "nn_neuron_init"
    },
    {
      "label": ".__call__()",
      "file_type": "code",
      "source_file": "/home/safi/graph3d-benchmark/repos/micrograd/micrograd/nn.py",
      "source_location": "L20",
      "community": 3,
      "id": "nn_neuron_call"
    },
    {
      "label": ".parameters()",
      "file_type": "code",
      "source_file": "/home/safi/graph3d-benchmark/repos/micrograd/micrograd/nn.py",
      "source_location": "L24",
      "community": 3,
      "id": "nn_neuron_parameters"
    },
    {
      "label": ".__repr__()",
      "file_type": "code",
      "source_file": "/home/safi/graph3d-benchmark/repos/micrograd/micrograd/nn.py",
      "source_location": "L27",
      "community": 3,
      "id": "nn_neuron_repr"
    },
    {
      "label": "Layer",
      "file_type": "code",
      "source_file": "/home/safi/graph3d-benchmark/repos/micrograd/micrograd/nn.py",
      "source_location": "L30",
      "community": 3,
      "id": "nn_layer"
    },
    {
      "label": ".__init__()",
      "file_type": "code",
      "source_file": "/home/safi/graph3d-benchmark/repos/micrograd/micrograd/nn.py",
      "source_location": "L32",
      "community": 3,
      "id": "nn_layer_init"
    },
    {
      "label": ".__call__()",
      "file_type": "code",
      "source_file": "/home/safi/graph3d-benchmark/repos/micrograd/micrograd/nn.py",
      "source_location": "L35",
      "community": 3,
      "id": "nn_layer_call"
    },
    {
      "label": ".parameters()",
      "file_type": "code",
      "source_file": "/home/safi/graph3d-benchmark/repos/micrograd/micrograd/nn.py",
      "source_location": "L39",
      "community": 3,
      "id": "nn_layer_parameters"
    },
    {
      "label": ".__repr__()",
      "file_type": "code",
      "source_file": "/home/safi/graph3d-benchmark/repos/micrograd/micrograd/nn.py",
      "source_location": "L42",
      "community": 3,
      "id": "nn_layer_repr"
    },
    {
      "label": "MLP",
      "file_type": "code",
      "source_file": "/home/safi/graph3d-benchmark/repos/micrograd/micrograd/nn.py",
      "source_location": "L45",
      "community": 3,
      "id": "nn_mlp"
    },
    {
      "label": ".__init__()",
      "file_type": "code",
      "source_file": "/home/safi/graph3d-benchmark/repos/micrograd/micrograd/nn.py",
      "source_location": "L47",
      "community": 3,
      "id": "nn_mlp_init"
    },
    {
      "label": ".__call__()",
      "file_type": "code",
      "source_file": "/home/safi/graph3d-benchmark/repos/micrograd/micrograd/nn.py",
      "source_location": "L51",
      "community": 3,
      "id": "nn_mlp_call"
    },
    {
      "label": ".parameters()",
      "file_type": "code",
      "source_file": "/home/safi/graph3d-benchmark/repos/micrograd/micrograd/nn.py",
      "source_location": "L56",
      "community": 3,
      "id": "nn_mlp_parameters"
    },
    {
      "label": ".__repr__()",
      "file_type": "code",
      "source_file": "/home/safi/graph3d-benchmark/repos/micrograd/micrograd/nn.py",
      "source_location": "L59",
      "community": 3,
      "id": "nn_mlp_repr"
    },
    {
      "community": 3,
      "id": "random"
    },
    {
      "community": 3,
      "id": "micrograd_engine"
    },
    {
      "label": "setup.py",
      "file_type": "code",
      "source_file": "/home/safi/graph3d-benchmark/repos/minGPT/setup.py",
      "source_location": "L1",
      "community": 9,
      "id": "setup"
    },
    {
      "community": 9,
      "id": "setuptools"
    },
    {
      "label": "test_engine.py",
      "file_type": "code",
      "source_file": "/home/safi/graph3d-benchmark/repos/micrograd/test/test_engine.py",
      "source_location": "L1",
      "community": 1,
      "id": "test_engine"
    },
    {
      "label": "test_sanity_check()",
      "file_type": "code",
      "source_file": "/home/safi/graph3d-benchmark/repos/micrograd/test/test_engine.py",
      "source_location": "L4",
      "community": 1,
      "id": "test_engine_test_sanity_check"
    },
    {
      "label": "test_more_ops()",
      "file_type": "code",
      "source_file": "/home/safi/graph3d-benchmark/repos/micrograd/test/test_engine.py",
      "source_location": "L28",
      "community": 1,
      "id": "test_engine_test_more_ops"
    },
    {
      "community": 1,
      "id": "torch"
    },
    {
      "label": "bpe.py",
      "file_type": "code",